{
  "active_phase": "PH-D02B",
  "audit_baseline_commit": "3a7d96755cf6819d36e824fe4b64ae4086f1af98",
  "audit_report_sha256": "8536f4644fdc56cc71fa5a43699b43894c8f5d2c007ff772d68c29cc4546c1c1",
  "authority_manifest_path": "docs/strategy/REV3_CURRENT_AUTHORITY_MANIFEST.json",
  "current_phase_candidates": {
    "classification": "POST_AUDIT_IMPLEMENTATION_IN_PROGRESS_REQUIRING_EXACT_TREE_VALIDATION",
    "eligible_for_phase_exit": false,
    "paths": [
      "analysis/rev3/ph_d02b_schema_bundle_preinventory.json",
      "docs/strategy/contracts/HDS_STRUCTURE_BUNDLE_CONTRACT_V1.json",
      "distillation/input/historical_pre_audit/PH-D02B/SNAPSHOT_MANIFEST.json",
      "distillation/input/post_audit_schema_bundle_contract.json",
      "distillation/schema_sets/ph_d02b_v1",
      "distillation/src/hds_distill/post_audit_schema_bundle.py",
      "distillation/tests/unit/test_post_audit_schema_bundle.py",
      "distillation/artifacts/test_vectors/post_audit_schema_bundle_examples.json",
      "distillation/artifacts/test_vectors/post_audit_schema_bundle_invalid_cases.json",
      "distillation/artifacts/reports/post_audit_schema_bundle_conformance.json",
      "scripts/build_ph_d02b_schema_bundle.py"
    ]
  },
  "current_work_class": "PH-D02B_SCHEMA_SET_BUNDLE_CONTRACT_REBIND",
  "distilled_initial_state_bundle_status": "NOT_FROZEN",
  "historical_evidence": {
    "classification": "HISTORICAL_PRE_AUDIT_NONAUTHORITATIVE",
    "eligible_for_current_activation": false,
    "preserve": true,
    "scope": [
      "control/rev3/HISTORICAL_PRE_AUDIT/**",
      "control/rev3/HISTORICAL_PRE_AUDIT/PH-D01A/**",
      "control/rev3/HISTORICAL_PRE_AUDIT/PH-D01B/**",
      "control/rev3/HISTORICAL_PRE_AUDIT/PH-D02A/**",
      "control/rev3/HISTORICAL_PRE_AUDIT/PH-D02B/**",
      "control/rev3/D02C_PHASE_STATE.json",
      "control/rev3/D03A_CANDIDATE_STATE.json",
      "control/rev3/OWNER_APPROVAL_RECORDS/PH-R00.json",
      "control/rev3/OWNER_REVIEW_PACKAGE",
      "control/rev3/PH-D02C_OWNER_REVIEW_PACKAGE",
      "control/rev3/PH-D03A_OWNER_REVIEW_PACKAGE",
      "control/rev3/PHASE_TRANSITIONS/PH-D02C_TO_PH-D03A.json",
      "control/rev3/PH-R00_VALIDATION_REWORK_FRAME.json",
      "docs/strategy/REV3_AUTHORITY_INPUT_MANIFEST.json",
      "distillation/input/schema_contract.json",
      "distillation/schemas",
      "distillation/src/hds_distill/schema_registry.py",
      "distillation/src/hds_distill/causal_ir.py",
      "distillation/src/hds_distill/interpreter.py",
      "distillation/src/hds_distill/golden_corpus.py",
      "distillation/artifacts/reports/schema_conformance.json",
      "distillation/artifacts/test_vectors/schema_examples"
    ]
  },
  "installation_approval": {
    "approval_artifact_digest": "owner-approval-record:32de1b2446b1dfc5fdecd187a65077cbb5f1569a115aa6dbebfc08ad3b1970b8",
    "approval_record_path": "control/rev3/OWNER_APPROVAL_RECORDS/REV3_DOC_FIX_TO_PH-R-1_20260731.json",
    "decision_capture_digest": "sha256:58d3caa32976cf6288818e58e225228d4e0e5a1c710c44f67ee164561ea931dd",
    "decision_capture_path": "control/rev3/OWNER_DECISION_CAPTURES/REV3_DOC_FIX_TO_PH-R-1_20260731.json",
    "target_artifact_digest": "sha256:3fe2ae584a5df80ac80e6f44b66446f7ad11e926530a552a98b4d7643041e219",
    "target_evidence_commit": "95c8fb0f1551716191769747d65816e273cf7640"
  },
  "installation_status": "INSTALLED",
  "next_phase_after_current_phase": "PH-D02C",
  "phase_entry_approval": {
    "approval_artifact_digest": "owner-approval-record:cf8fae68b34e144dfc2a7f58fbbb9520cdc91e47a13775870e9e89b521e1facd",
    "approval_record_path": "control/rev3/OWNER_APPROVAL_RECORDS/PH-D02A_TO_PH-D02B_20260731.json",
    "decision_capture_digest": "sha256:32f5f73cdc59fb4cc57fe184c876c46148d2e2a17250bcccbec1253c4ae01ccd",
    "decision_capture_path": "control/rev3/OWNER_DECISION_CAPTURES/PH-D02A_TO_PH-D02B_20260731.json",
    "target_artifact_digest": "sha256:b6f78c8060e7b39521e01ca4dbbf84535acc7a64372b15f8a53d404c8c088d01",
    "target_evidence_commit": "78aaf2a4f3bc00c5aa8ec66c6414b19ad6089dd3"
  },
  "ph_d00a_status": "OWNER_APPROVED_PASS",
  "ph_d00b_status": "OWNER_APPROVED_PASS",
  "ph_d01a_status": "OWNER_APPROVED_PASS",
  "ph_d01b_status": "OWNER_APPROVED_PASS",
  "ph_d02a_status": "OWNER_APPROVED_PASS",
  "ph_d02b_status": "IN_PROGRESS",
  "ph_r00_owner_authorization": "ESTABLISHED",
  "ph_r00_status": "OWNER_APPROVED_PASS",
  "ph_r1_status": "OWNER_APPROVED_PASS",
  "runtime_activation_status": "SUSPEND",
  "schema_version": "arc3-rev3-current-selector-v10",
  "standing_authorization": {
    "content_digest": "sha256:221c15869ea930a1d28bdac301280c0f3604010ed9ce108ad92d22a580ece4ed",
    "path": "control/rev3/OWNER_STANDING_AUTHORIZATIONS/CONTINUOUS_INTERNAL_DEVELOPMENT_20260731.json"
  },
  "strategy_id": "ARC3_HDS_DISTILLATION_FIRST_AUTONOMOUS_COMPLETION_SPEC_REV3",
  "strategy_status": "OWNER_APPROVED"
}
